Title,Journal,Publication Date,PubMed ID,Abstract
Functional Peptide-Loaded Gelatin Nanoparticles as Eyedrops for Cornea Neovascularization Treatment.,International journal of nanomedicine,2023,36992821,"BACKGROUND: Corneal neovascularization (NV) is a process of abnormal vessel growth into the transparent cornea from the limbus and can disturb the light passing through the cornea, resulting in vision loss or even blindness. The use of nanomedicine as an effective therapeutic formulation in ophthalmology has led to higher drug bioavailability and a slow drug release rate. In this research, we designed and explored the feasibility of a new nanomedicine, gp91 ds-tat (gp91) peptide-encapsulated gelatin nanoparticles (GNP-gp91), for inhibiting corneal angiogenesis. METHODS: GNP-gp91 were prepared by a two-step desolvation method. The characterization and cytocompatibility of GNP-gp91 were analyzed. The inhibition effect of GNP-gp91 on HUVEC cell migration and tube formation was observed by an inverted microscope. The drug retention test in mouse cornea was observed by in vivo imaging system, fluorescence microscope, and DAPI/TAMRA staining. Finally, the therapeutic efficacy and evaluation of neovascularization-related factors were conducted through the in vivo corneal NV mice model via topical delivery. RESULTS: The prepared GNP-gp91 had a nano-scale diameter (550.6 nm) with positive charge (21.7 mV) slow-release behavior (25%, 240hr). In vitro test revealed that GNP-gp91 enhanced the inhibition of cell migration and tube formation capacity via higher internalization of HUVEC. Topical administration (eyedrops) of the GNP-gp91 significantly prolongs the retention time (46%, 20 min) in the mouse cornea. In chemically burned corneal neovascularization models, corneal vessel area with a significant reduction in GNP-gp91 group (7.89%) was revealed when compared with PBS (33.99%) and gp91 (19.67%) treated groups via every two days dosing. Moreover, GNP-gp91 significantly reduced the concentration of Nox2, VEGF and MMP9 in NV's cornea. CONCLUSION: The nanomedicine, GNP-gp91, was successfully synthesized for ophthalmological application. These data suggest that GNP-gp91 contained eyedrops that not only have a longer retention time on the cornea but also can treat mice corneal NV effectively delivered in a low dosing frequency, GNP-gp91 eyedrops provides an alternative strategy for clinical ocular disease treatment in the culture."
Increased Frequency of Diabetic Ketoacidosis: The Link With COVID-19 Pandemic.,Frontiers in clinical diabetes and healthcare,2022,36992744,"AIMS: Diabetic ketoacidosis is the most severe metabolic derangement due to prolonged insulin deficiency as in type 1 diabetes. Diabetic ketoacidosis, a life-threatening condition, is often diagnosed late. A timely diagnosis is mandatory to prevent its consequences, mainly neurological. The COVID-19 pandemic and lockdown have reduced the availability of medical care and access to hospitals. The aim of our retrospective study was to compare the frequency of ketoacidosis at the diagnosis of type 1 diabetes between the lockdown-post lockdown period and the previous two calendar years, in order to evaluate the impact of the COVID-19 pandemic. PATIENTS AND METHODS: We retrospectively assessed the clinical and metabolic data at the diagnosis of type 1 diabetes in children in the Liguria Region during 3 different time periods: calendar year 2018 (Period A), calendar year 2019 until February 23,2020 (Period B) and from February 24, 2020 onwards to March 31, 2021 (Period C). RESULTS: We analyzed 99 patients with newly-diagnosed T1DM from 01/01/2018 to 31/03/2021. Briefly, a younger age at diagnosis of T1DM was observed in Period 2 compared to Period 1 (p = 0.03). The frequency of DKA at clinical onset of T1DM was similar in Period A (32.3%) and Period B (37.5%), while it significantly increased in Period C (61.1%) compared to Period B (37.5%) (p = 0.03). PH values were similar in Period A (7.29 +/- 0.14) and Period B (7.27 +/- 0.17), while they were significantly lower in Period C (7.21 +/- 0.17) compared to Period B (p = 0.04). CONCLUSIONS: An increase in the frequency of diabetic ketoacidosis has been documented in newly diagnosed pediatric patients in the Liguria Region during and after the lockdown period compared to previous calendar years. This increase could have been caused by the delay in diagnosis following the restrictions imposed by the lockdown with consequently reduced access to health care facilities. More information on the risks of ketoacidosis is desirable by means of social and medical awareness campaigns."
"The co-development of a linguistic and culturally tailored tele-retinopathy screening intervention for immigrants living with diabetes from China and African-Caribbean countries in Ottawa, Canada.",BMC health services research,2023 Mar 29,36991464,"BACKGROUND: Diabetic retinopathy is a sight-threatening ocular complication of diabetes. Screening is an effective way to reduce severe complications, but screening attendance rates are often low, particularly for newcomers and immigrants to Canada and people from cultural and linguistic minority groups. Building on previous work, in partnership with patient and health system stakeholders, we co-developed a linguistically and culturally tailored tele-retinopathy screening intervention for people living with diabetes who recently immigrated to Canada from either China or African-Caribbean countries. METHODS: Following an environmental scan of diabetes eye care pathways in Ottawa, we conducted co-development workshops using a nominal group technique to create and prioritize personas of individuals requiring screening and identify barriers to screening that each persona may face. Next, we used the Theoretical Domains Framework to categorize the barriers/enablers and then mapped these categories to potential evidence-informed behaviour change techniques. Finally with these techniques in mind, participants prioritized strategies and channels of delivery, developed intervention content, and clarified actions required by different actors to overcome anticipated intervention delivery barriers. RESULTS: We carried out iterative co-development workshops with Mandarin and French-speaking individuals living with diabetes (i.e., patients in the community) who immigrated to Canada from China and African-Caribbean countries (n = 13), patient partners (n = 7), and health system partners (n = 6) recruited from community health centres in Ottawa. Patients in the community co-development workshops were conducted in Mandarin or French. Together, we prioritized five barriers to attending diabetic retinopathy screening: language (TDF Domains: skills, social influences), retinopathy familiarity (knowledge, beliefs about consequences), physician barriers regarding communication for screening (social influences), lack of publicity about screening (knowledge, environmental context and resources), and fitting screening around other activities (environmental context and resources). The resulting intervention included the following behaviour change techniques to address prioritized local barriers: information about health consequence, providing instructions on how to attend screening, prompts/cues, adding objects to the environment, social support, and restructuring the social environment. Operationalized delivery channels incorporated language support, pre-booking screening and sending reminders, social support via social media and community champions, and providing using flyers and videos as delivery channels. CONCLUSION: Working with intervention users and stakeholders, we co-developed a culturally and linguistically relevant tele-retinopathy intervention to address barriers to attending diabetic retinopathy screening and increase uptake among two under-served groups."
"Authors reply to the 'Response to ""Similarities in clinical course and outcome between juvenile idiopathic arthritis (JIA)-associated and ANA-positive idiopathic anterior uveitis: data from a population-based nationwide study in Germany""'.",Arthritis research & therapy,2023 Mar 29,36991432,N/A
Investigation of the Relationship Between Cognitive Functions and Retinal Findings From Spectral Optical Coherence Tomography in Patients With Schizophrenia and Their Healthy Siblings.,Psychiatry investigation,2023 Mar,36990667,"OBJECTIVE: Retinal structural changes which were investigated by optical coherence tomography (OCT) have been reported in schizophrenia. Since cognitive dysfunction is a core feature of schizophrenia, the correlations between retinal findings and cognitive functions of patients and their healthy siblings may provide insight into the pathophysiological processes of the disorder. We aimed to investigate the relationship between neuropsychiatric tests and retinal changes in schizophrenia patients and their healthy siblings. METHODS: We measured OCT parameters and cognitive performance (via Trail Making Tests, verbal fluency tests, and The Digit Span Tests) of 72 participants (36 patients with schizophrenia and 36 healthy siblings) and disease severity (with Positive and Negative Syndrome Scale, Global Assessment of Functioning, and Clinical Global Impression scales) in patients with schizophrenia and evaluated the relationship between retinal findings and clinical parameters, especially neurocognitive tests. RESULTS: We found decreased ganglion cell layer-inner plexiform layer thickness and macular volume in the patient group. There were strong correlations between neurocognitive tests and OCT findings in both groups. On the other hand, there was not any correlation between retinal findings and disease parameters. CONCLUSION: The cognitive symptoms of schizophrenia may be more closely related to structural changes in the retina."
Factors Linked to Injection Interval Extension in Eyes with Wet Age-Related Macular Degeneration Switched to Brolucizumab.,Ophthalmology,2023 Mar 27,36990322,"PURPOSE: To evaluate factors associated with anti-VEGF injection interval extension in patients with neovascular age-related macular degeneration (nAMD) switched to brolucizumab. DESIGN: Retrospective observational cohort study. PARTICIPANTS: Adults in the US-based Intelligent Research in Sight (IRIS) Registry with nAMD who switched from another anti-VEGF agent (treatment-experienced) to brolucizumab-only treatment for at least 12 months in the time period of 10/08/2019 through 11/26/2021. METHODS: Univariate and multivariable analyses were used to examine associations of demographic and clinical characteristics with the likelihood of interval extension following switch to brolucizumab therapy. MAIN OUTCOME MEASURES: Eyes were classified as either ""extenders"" or ""non-extenders"" at 12 months. ""Extenders"" were eyes that achieved (i) an extension of >/= 2 weeks in the brolucizumab injection interval at 12 months versus the pre-switch interval (time between the last known prior anti-VEGF injection and first [""index""] brolucizumab injection) and (ii) stable (< 10 letters gained or lost) or improved (>/= 10 letters gained) visual acuity (VA) at 12 months compared with VA at index. RESULTS: Of the 2015 eyes among 1890 patients that switched to brolucizumab, 1186 eyes (58.9%) were ""extenders"". In univariate analyses, demographic and clinical characteristics were comparable between extenders and non-extenders, except that extenders had a shorter pre-switch interval compared with non-extenders (mean 5.9 +/- 2.1 versus 10.1 +/- 7.6 weeks, respectively). The multivariable logistic regression model showed that a shorter pre-switch interval was significantly and positively associated with interval extension with brolucizumab therapy (adjusted odds ratio 5.6 for pre-switch interval of <8 weeks compared with >/=8 weeks; 95% confidence interval 4.5-6.9; P <0.001), and that eyes with an index VA of 40-65 letters were significantly less likely to be extenders than eyes in the higher (better) index VA categories. CONCLUSIONS: Length of the pre-switch treatment interval was the characteristic most strongly associated with successful interval extension with brolucizumab. Treatment-experienced patients who required more frequent injections (i.e., shorter pre-switch intervals) showed the greatest extensions when switching to brolucizumab. With careful consideration of the benefits/risks, brolucizumab may be a valuable treatment option for patients whose treatment burden is higher due to the need for frequent injections."
MicroRNAs of extracellular vesicles derived from mesenchymal stromal cells alleviate inflammation in dry eye disease by targeting the IRAK1/TAB2/NF-kappaB pathway.,The ocular surface,2023 Mar 27,36990276,"PURPOSE: To investigate the efficacy and mechanisms of human umbilical cord-derived MSC-derived extracellular vesicles (hucMSC-EVs) in a mouse model of desiccation-induced dry eye disease (DED). METHODS: hucMSC-EVs were enriched by ultracentrifugation. The DED model was induced by desiccating environment combined with scopolamine administration. The DED mice were divided into the hucMSC-EVs group, fluorometholone (FML) group, PBS group, and blank control group. Tear secretion, corneal fluorescein staining, the cytokine profiles in tears and goblet cells, TUNEL-positive cell, and CD4(+) cells were examined to assess therapeutic efficiency. The miRNAs in the hucMSC-EVs were sequenced, and the top 10 were used for miRNA enrichment analysis and annotation. The targeted DED-related signaling pathway was further verified by using RT‒qPCR and western blotting. RESULTS: Treatment with hucMSC-EVs increased the tear volume and maintained corneal integrity in DED mice. The cytokine profile in the tears of the hucMSC-EVs group presented with a lower level of proinflammatory cytokines than PBS group. Moreover, hucMSC-EVs treatment increased goblet cell density and inhibited cell apoptosis and CD4(+) cell infiltration. Functional analysis of the top 10 miRNAs in hucMSC-EVs showed a high correlation with immunity. Among them, miR-125 b, let-7b, and miR-6873 were conserved between humans and mice and were associated with the IRAK1/TAB2/NF-kappaB pathway that was activated in DED. Furthermore, IRAK1/TAB2/NF-kappaB pathway activation and the abnormal expression of IL-4, IL-8, IL-10, IL-13, IL-17, and TNF-alpha were reversed by hucMSC-EVs. CONCLUSIONS: hucMSCs-EVs alleviate DED signs, suppress inflammation and restore homeostasis of the corneal surface by multitargeting the IRAK1/TAB2/NF-kappaB pathway via certain miRNAs."
Successful restoration of corneal surface integrity with a tissue-engineered allogeneic implant in severe keratitis patients.,Biomedicine & pharmacotherapy = Biomedecine & pharmacotherapie,2023 Mar 27,36989713,"OBJECTIVES: Corneal diseases are among the main causes of blindness, with approximately 4.6 and 23 million patients worldwide suffering from bilateral and unilateral corneal blindness, respectively. The standard treatment for severe corneal diseases is corneal transplantation. However, relevant disadvantages, particularly in high-risk conditions, have focused the attention on the search for alternatives. METHODS: We report interim findings of a phase I-II clinical study evaluating the safety and preliminary efficacy of a tissue-engineered corneal substitute composed of a nanostructured fibrin-agarose biocompatible scaffold combined with allogeneic corneal epithelial and stromal cells (NANOULCOR). 5 subjects (5 eyes) suffering from trophic corneal ulcers refractory to conventional treatments, who combined stromal degradation or fibrosis and limbal stem cell deficiency, were included and treated with this allogeneic anterior corneal substitute. RESULTS: The implant completely covered the corneal surface, and ocular surface inflammation decreased following surgery. Only four adverse reactions were registered, and none of them were severe. No detachment, ulcer relapse nor surgical re-interventions were registered after 2 years of follow-up. No signs of graft rejection, local infection or corneal neovascularization were observed either. Efficacy was measured as a significant postoperative improvement in terms of the eye complication grading scales. Anterior segment optical coherence tomography images revealed a more homogeneous and stable ocular surface, with complete scaffold degradation occurring within 3-12 weeks after surgery. CONCLUSIONS: Our findings suggest that the surgical application of this allogeneic anterior human corneal substitute is feasible and safe, showing partial efficacy in the restoration of the corneal surface."
Pathologically high intraocular pressure induces mitochondrial dysfunction through Drp1 and leads to retinal ganglion cell PANoptosis in glaucoma.,Redox biology,2023 Mar 21,36989574,"Glaucoma is a common neurodegenerative disease characterized by progressive retinal ganglion cell (RGC) loss and visual field defects. Pathologically high intraocular pressure (ph-IOP) is an important risk factor for glaucoma, and it triggers molecularly distinct cascades that control RGC death and axonal degeneration. Dynamin-related protein 1 (Drp1)-mediated abnormalities in mitochondrial dynamics are involved in glaucoma pathogenesis; however, little is known about the precise pathways that regulate RGC injury and death. Here, we aimed to investigate the role of the ERK1/2-Drp1-reactive oxygen species (ROS) axis in RGC death and the relationship between Drp1-mediated mitochondrial dynamics and PANoptosis in ph-IOP injury. Our results suggest that inhibiting the ERK1/2-Drp1-ROS pathway is a potential therapeutic strategy for treating ph-IOP-induced injuries. Furthermore, inhibiting Drp1 can regulate RGC PANoptosis by modulating caspase3-dependent, nucleotide-binding oligomerization domain-like receptor-containing pyrin domain 3(NLRP3)-dependent, and receptor-interacting protein (RIP)-dependent pathways in the ph-IOP model. Overall, our findings provide new insights into possible protective interventions that could regulate mitochondrial dynamics to improve RGC survival."
"The photoreceptor protective cGMP-analog Rp-8-Br-PET-cGMPS interacts with cGMP-interactors PKGI, PDE1, PDE6, and PKAI in the degenerating mouse retina.",The Journal of comparative neurology,2023 Mar 29,36989379,"The inherited eye disease retinitis pigmentosa (RP) causes the loss of photoreceptors by a still unknown cell death mechanism. During this degeneration, cyclic guanosine-3',5'-monophosphate (cGMP) levels become elevated, leading to over-activation of the cGMP-binding protein cGMP-dependent protein kinase (PKG). cGMP analogs selectively modified to have inhibitory actions on PKG have aided in impeding photoreceptor death, and one such cGMP analog is Rp-8-Br-PET-cGMPS. However, cGMP analogs have previously been shown to interact with numerous targets, so to better understand the therapeutic action of Rp-8-Br-PET-cGMPS, it is necessary to elucidate its target-selectivity and hence what potential cellular mechanism(s) it may affect within the photoreceptors. Here, we, therefore, applied affinity chromatography together with mass spectrometry to isolate and identify Rp-8-Br-PET-cGMPS interactors from retinas derived from three different murine RP models (i.e., rd1, rd2, and rd10 mice). Our findings revealed that Rp-8-Br-PET-cGMPS bound seven known cGMP-binding proteins, including PKG1beta, PDE1beta, PDE1c, PDE6alpha, and PKA1alpha. Furthermore, an additional 28 proteins were found to be associated with Rp-8-Br-PET-cGMPS. This latter group included MAPK1/3, which is known to connect with cGMP/PKG in other systems. However, in organotypic retinal cultures, Rp-8-Br-PET-cGMPS had no effect on photoreceptor MAPK1/3 expression or activity. To summarize, Rp-8-Br-PET-cGMPS is more target specific compared to regular cGMP."
Robust Acute Pancreatitis Identification and Diagnosis: RAPIDx.,ACS nano,2023 Mar 29,36988967,"The occurrence of acute pancreatitis (AP) is increasing significantly worldwide. However, current diagnostic methods of AP do not provide a clear clinical stratification of severity, and the prediction of complications in AP is still limited. Here, we present a robust AP identification and diagnosis (RAPIDx) method by the proteomic fingerprinting of intact nanoscale extracellular vesicles (EVs) from clinical samples. By tracking analysis of circulating biological nanoparticles released by cells (i.e., EVs) via bottom-up proteomics, we obtain close phenotype connections between EVs, cell types, and multiple tissues based on their specific proteomes and identify the serum amyloid A (SAA) proteins on EVs as potential biomarkers that are differentially expressed from AP patients significantly. We accomplish the quantitative analysis of EVs fingerprints using MALDI-TOF MS and find the SAA proteins (SAA1-1, desR-SAA1-2, SAA2, SAA1-2) with areas under the curve (AUCs) from 0.92 to 0.97, which allows us to detect AP within 30 min. We further realize that SAA1-1 and SAA2, combined with two protein peaks (5290.19, 14032.33 m/z), can achieve an AUC of 0.83 for classifying the severity of AP. The RAPIDx platform will facilitate timely diagnosis and treatment of AP before severity development and persistent organ failure and promote precision diagnostics and the early diagnosis of pancreatic cancer."
Quadrant Asymmetry in Optical Coherence Tomography Angiography Metrics in Ischemic Versus Non-Ischemic Central Retinal Vein Occlusion Eyes.,Translational vision science & technology,2023 Mar 1,36988945,"PURPOSE: To determine whether quadrant asymmetry (QA) of optical coherence tomography angiography (OCTA) metrics differs between non-ischemic versus ischemic central retinal vein occlusion (CRVO). METHODS: Fifty-eight eyes (21 non-ischemic, 10 ischemic CRVO, and 27 contralateral control eyes) underwent 3 x 3 mm spectral-domain OCTA scans with quantification of the superficial retinal layer vessel length density (VLD) and perfusion density (PD). QA, defined as the maximum-minus-minimum value among four parafoveal Early Treatment Diabetic Retinopathy Study (ETDRS) quadrants, was compared by linear regression including fixed effects for each eye. RESULTS: Mean age was 73.6 +/- 11.4 (range 39-88), 73.8 +/- 12.4 (range 39-91) and 77.2 +/- 9.83, (range 60-88); and QA was 3.46 +/- 1.76, 3.14 +/- 1.57, and 4.88 +/- 2.42 for VLD and 0.072 +/- 0.038, 0.062 +/- 0.036, and 0.11 +/- 0.056 for PD for control, non-ischemic, and ischemic, respectively. QA was significantly higher in ischemic (0.109 +/- 0.056) than non-ischemic CRVO eyes (0.062 +/- 0.036; P = 0.02) and control eyes for PD (0.072 +/- 0.038; P = 0.03). QA was also greater in ischemic (4.875 +/- 2.418) than non-ischemic CRVO (3.141 +/- 1.572) for VLD (P = 0.04). In terms of identifying which particular quadrant is most affected by ischemia, multivariate regression analysis comparing intra-quadrant effect on the presence of ischemia versus non-ischemia showed no quadrant was significantly affected (P > 0.05 for all quadrants). CONCLUSIONS: Ischemic CRVO increases intraeye QA of OCTA metrics when compared to non-ischemic CRVO and control eyes. No specific ETDRS quadrant appears to be more affected. TRANSLATIONAL RELEVANCE: This work uses an intraeye method to delineate between ischemic and non-ischemic CRVO by OCTA imaging, overcoming inter-eye variables encountered in clinical care."
EULAR study group on 'MHC-I-opathy': identifying disease-overarching mechanisms across disciplines and borders.,Annals of the rheumatic diseases,2023 Mar 27,36987655,"The 'MHC-I (major histocompatibility complex class I)-opathy' concept describes a family of inflammatory conditions with overlapping clinical manifestations and a strong genetic link to the MHC-I antigen presentation pathway. Classical MHC-I-opathies such as spondyloarthritis, Behcet's disease, psoriasis and birdshot uveitis are widely recognised for their strong association with certain MHC-I alleles and gene variants of the antigen processing aminopeptidases ERAP1 and ERAP2 that implicates altered MHC-I peptide presentation to CD8+T cells in the pathogenesis. Progress in understanding the cause and treatment of these disorders is hampered by patient phenotypic heterogeneity and lack of systematic investigation of the MHC-I pathway.Here, we discuss new insights into the biology of MHC-I-opathies that strongly advocate for disease-overarching and integrated molecular and clinical investigation to decipher underlying disease mechanisms. Because this requires transformative multidisciplinary collaboration, we introduce the EULAR study group on MHC-I-opathies to unite clinical expertise in rheumatology, dermatology and ophthalmology, with fundamental and translational researchers from multiple disciplines such as immunology, genomics and proteomics, alongside patient partners. We prioritise standardisation of disease phenotypes and scientific nomenclature and propose interdisciplinary genetic and translational studies to exploit emerging therapeutic strategies to understand MHC-I-mediated disease mechanisms. These collaborative efforts are required to address outstanding questions in the etiopathogenesis of MHC-I-opathies towards improving patient treatment and prognostication."
